<?xml version="1.0"?>
<config xmlns:xsi="http://www.w3.org/2001/XMLSchema-instance"
        xsi:noNamespaceSchemaLocation="config.xsd"
        formatName="Sample Fixed Column Length Format"
        ignoredLinePattern="\*.*">
  <lineType type="header" pattern="H .*" num="1">
    <extractor type="fixed">
      <field startPos="3" endPos="7" trim="no"/>
      <field startPos="9" endPos="9"/>
      <field startPos="11" endPos="13"/>
      <field startPos="15" endPos="33"/>
      <field startPos="35" endPos="37"/>
    </extractor>
    <validators>
      <validator type="regex" fieldIndex="1" pattern="[0-9]{5}"/>
      <validator type="regex" fieldIndex="2" pattern="[D|N]"/>
      <validator type="numberComparison" fieldIndex="3"
                 operator="greaterOrEqual" value="123"/>
      <validator type="fieldType" fieldIndex="4" fieldType="Date"
                 format="yyyy-MM-dd-HH:mm:ss"/>
      <validator type="regex" fieldIndex="5" pattern="[A-Z]{3}"/>
    </validators>
  </lineType>
  <lineType type="data" pattern="D .*" minNum="1">
    <extractor type="fixed">
      <field startPos="3" endPos="6"/>
      <field startPos="8" endPos="11"/>
      <field startPos="16" endPos="19"/>
      <field startPos="24" endPos="27"/>
      <field startPos="29" endPos="29"/>
      <field startPos="31" endPos="42"/>
      <field startPos="44" endPos="53"/>
      <field startPos="55" endPos="57"/>
      <field startPos="59" endPos="61"/>
    </extractor>
    <validators>
      <validator type="fieldType" fieldIndex="1" fieldType="Integer"/>
      <validator type="fieldType" fieldIndex="2" fieldType="Integer"
                 skipIfEmpty="yes"/>
      <validator type="fieldType" fieldIndex="3" fieldType="Integer"/>
      <validator type="fieldType" fieldIndex="4" fieldType="Integer"
                 skipIfEmpty="yes"/>
      <validator type="regex" fieldIndex="5" pattern="[F|U]"/>
      <validator type="regex" fieldIndex="6" pattern="[0-9]{9}\.[0-9]{2}"/>
      <validator type="dateComparison" fieldIndex="7" operator="greaterThan"
                 value="2009-01-01" format="yyyy-MM-dd"/>
      <validator type="twoNumberFieldsComparison" fieldIndex1="9" fieldIndex2="8"
                 operator="greaterThan"/>
    </validators>
  </lineType>
  <lineType type="footer" pattern="T .*" num="1">
    <extractor type="fixed">
      <field startPos="3" endPos="7"/>
      <field startPos="9" endPos="16"/>
      <field startPos="18" endPos="32"/>
    </extractor>
    <validators>
      <validator type="regex" fieldIndex="1" pattern="[0-9]{5}"/>
      <validator type="regex" fieldIndex="2" pattern="[0-9]{8}"/>
      <validator type="regex" fieldIndex="3" pattern="[0-9]{12}\.[0-9]{2}"/>
    </validators>
  </lineType>
</config>